3F;3F10010102;12;2279;РК суппорта 3F ГАЗ C41R11 NEXT, ПАЗ Вектор NEXT (направляющие суппорта) 081030911;1;FRO2
3F;3F10010162;15;2019;Рк суппорта ГАЗон  ПАЗ Вектор  прокладки болты втулки суппорт;1;FRO2
3F;3F10010172;3;742;Ремкомплект суппорта ГАЗон NEXT,ПАЗ Вектор NEXT (болт самоподводки);1;FRO2
3F;3F10010242;6;1784;Рк суппорта ГАЗон , ПАЗ Вектор  пластина упорная с пазом правая суппорт;1;FRO2
3F;3F10010252;2;1784;Ремкомплект суппорта ГАЗон NEXT,ПАЗ Вектор NEXT (пластина упорная с ПАЗом левая);1;FRO2
3F;3F10010282;7;2345;Рк суппорта ГАЗон , ПАЗ Вектор  вилка суппорт;1;FRO2
3F;3F10010292;14;677;Рк суппорта ГАЗон , ПАЗ Вектор  подшипники суппорт;1;FRO2
3F;3F10010312;17;4163;Ремкомплект суппорта ГАЗон NEXT,ПАЗ Вектор NEXT (механизм выбора зазора супорта);1;FRO2
3F;3F20020164;10;586;Ремкомплект суппорта Валдай (пятак);1;FRO2
3F;3F20020754;5;495;Ремкомплект суппорта Валдай (цепь механизма);1;FRO2
3F;3F20022184;1;2345;Автодеталь;1;FRO2
3F;3F20022194;1;1954;Рк суппорта Валдай механизм выбора зазора суппорт;1;FRO2
3F;3F20022464;1;1758;Рк суппорта Валдай корпус калибровочного винтавозвратные пружины суппорт;1;FRO2
3F;3F20022484;2;612;Рк суппорта Валдай подшипники суппорт;1;FRO2
3F;3F20022514;2;915;Р/к суппорта Валдай (крышка с болтами) суппорт KNORR;1;FRO2
